doi,title,abstract,date,category,disease_label,keyword_used
10.1101/2020.03.13.990598,Dark proteome of Newly Emerged SARS-CoV-2 in Comparison with Human and Bat Coronaviruses,"Recently emerged coronavirus designated as SARS-CoV-2 (also known as 2019 novel coronavirus (2019-nCoV) or Wuhan coronavirus) is a causative agent of coronavirus disease 2019 (COVID-19), which is rapidly spreading throughout the world now. More than 9,00,000 cases of SARS-CoV-2 infection and more than 47,000 COVID-19-associated mortalities have been reported worldwide till the writing of this article, and these numbers are increasing every passing hour. World Health Organization (WHO) has declared the SARS-CoV-2 spread as a global public health emergency and admitted that the COVID-19 is a pandemic now. The multiple sequence alignment data correlated with the already published reports on the SARS-CoV-2 evolution and indicated that this virus is closely related to the bat Severe Acute Respiratory Syndrome-like coronavirus (bat SARS-like CoV) and the well-studied Human SARS coronavirus (SARS CoV). The disordered regions in viral proteins are associated with the viral infectivity and pathogenicity. Therefore, in this study, we have exploited a set of complementary computational approaches to examine the dark proteomes of SARS-CoV-2, bat SARS-like, and human SARS CoVs by analysing the prevalence of intrinsic disorder in their proteins. According to our findings, SARS-CoV-2 proteome contains very significant levels of structural order. In fact, except for Nucleocapsid, Nsp8, and ORF6, the vast majority of SARS-CoV-2 proteins are mostly ordered proteins containing less intrinsically disordered protein regions (IDPRs). However, IDPRs found in SARS-CoV-2 proteins are functionally important. For example, cleavage sites in its replicase 1ab polyprotein are found to be highly disordered, and almost all SARS-CoV-2 proteins were shown to contain molecular recognition features (MoRFs), which are intrinsic disorder-based protein-protein interaction sites that are commonly utilized by proteins for interaction with specific partners. The results of our extensive investigation of the dark side of the SARS-CoV-2 proteome will have important implications for the structural and non-structural biology of SARS or SARS-like coronaviruses.

SignificanceThe infection caused by a novel coronavirus (SARS-CoV-2) that causes severe respiratory disease with pneumonia-like symptoms in humans is responsible for the current COVID-19 pandemic. No in-depth information on structures and functions of SARS-CoV-2 proteins is currently available in the public domain, and no effective anti-viral drugs and/or vaccines are designed for the treatment of this infection. Our study provides the first comparative analysis of the order- and disorder-based features of the SARS-CoV-2 proteome relative to human SARS and bat CoV that may be useful for structure-based drug discovery.",2020-03-14,bioinformatics,COVID-19,COVID-19
10.1101/2020.03.13.990036,Ocular conjunctival inoculation of SARS-CoV-2 can cause mild COVID-19 in Rhesus macaques,"The outbreak of Corona Virus Disease 2019 caused by the severe acute respiratory syndrome coronavirus (SARS-CoV-2) is highly transmitted. The potential extra-respiratory transmission routes remain uncertain. Five rhesus macaques were inoculated with 1x106 TCID50 of SARS-CoV-2 via conjunctival (CJ), intratracheal (IT), and intragastric (IG) routes, respectively. Remarkably, the CJ inoculated-macaques developed mild interstitial pneumonia and viral load was detectable in the conjunctival swabs at 1 days post-inoculation (dpi). Only via IT inoculation, viral load was detected in the anal swab at 1-7 dpi and macaque showed weight loss. However, viral load was undetectable after IG inoculation. Comparatively, viral load was higher in the nasolacrimal system but lesions of lung were relatively mild and local via CJ inoculation compared with that via IT inoculation, demonstrating distinct characteristics of virus dispersion. Both the two routes affected the alimentary tract. Therefore the clinicians need to protect eye while working with patients.",2020-03-30,microbiology,COVID-19,COVID-19
10.1101/2020.03.13.991083,Structural and functional conservation of the programmed -1 ribosomal frameshift signal of SARS-CoV-2,"17 years after the SARS-CoV epidemic, the world is facing the COVID-19 pandemic. COVID-19 is caused by a coronavirus named SARS-CoV-2. Given the most optimistic projections estimating that it will take over a year to develop a vaccine, the best short-term strategy may lie in identifying virus-specific targets for small molecule interventions. All coronaviruses utilize a molecular mechanism called -1 PRF to control the relative expression of their proteins. Prior analyses of SARS-CoV revealed that it employs a structurally unique three-stemmed mRNA pseudoknot to stimulate high rates of -1 PRF, and that it also harbors a -1 PRF attenuation element. Altering -1 PRF activity negatively impacts virus replication, suggesting that this molecular mechanism may be therapeutically targeted. Here we present a comparative analysis of the original SARS-CoV and SARS-CoV-2 frameshift signals. Structural and functional analyses revealed that both elements promote similar rates of -1 PRF and that silent coding mutations in the slippery sites and in all three stems of the pseudoknot strongly ablated -1 PRF activity. The upstream attenuator hairpin activity has also been functionally retained. Small-angle x-ray scattering indicated that the pseudoknots in SARS-CoV and SARS-CoV-2 had the same conformation. Finally, a small molecule previously shown to bind the SARS-CoV pseudoknot and inhibit -1 PRF was similarly effective against -1 PRF in SARS-CoV-2, suggesting that such frameshift inhibitors may provide promising lead compounds to counter the current pandemic.",2020-03-15,genetics,COVID-19,COVID-19
10.1101/2020.03.15.991844,RBD mutations from circulating SARS-CoV-2 strains enhance the structure stability and infectivity of the spike protein,"The current global pandemic of COVID-19 is caused by a novel coronavirus SARS-CoV-2. The SARS-CoV-2 spike protein receptor-binding domain (RBD) is the critical determinant of viral tropism and infectivity. To investigate whether naturally occurring mutations in the RBD during the early transmission phase have altered the receptor binding affinity and infectivity, firstly we analyzed in silico the binding dynamics between mutated SARS-CoV-2 RBDs and the human ACE2 receptor. Among 32,123 genomes of SARS-CoV-2 isolates (January through March, 2020), 302 non-synonymous RBD mutants were identified and clustered into 96 mutant types. The six dominant mutations were analyzed applying molecular dynamics simulations. The mutant type V367F continuously circulating worldwide displayed higher binding affinity to human ACE2 due to the enhanced structural stabilization of the RBD beta-sheet scaffold. The increased infectivity of V367 mutants was further validated by performing receptor-ligand binding ELISA, surface plasmon resonance, and pseudotyped virus assays. Genome phylogenetic analysis of V367F mutants showed that during the early transmission phase, most V367F mutants clustered more closely with the SARS-CoV-2 prototype strain than the dual-mutation variants (V367F + D614G) which emerged later and formed a distinct sub-cluster. The analysis of critical RBD mutations provides further insights into the evolutionary trajectory of SARS-CoV-2 under negative selection pressure and supports the continuing surveillance of spike mutations to aid in the development of new COVID-19 drugs and vaccines.

ImportanceA novel coronavirus SARS-CoV-2 has caused the pandemic of COVID-19. The origin of SARS-CoV-2 was associated with zoonotic infections. The spike protein receptor-binding domain (RBD) is identified as the critical determinant of viral tropism and infectivity. Thus, whether the mutations in the RBD of the circulating SARS-CoV-2 isolates have altered the receptor binding affinity and caused them more infectious, should be paid more attentions to. Given that SARS-CoV-2 is a novel coronavirus, the significance of our research is in identifying and validating the RBD mutant types emerging during the early transmission phase that have increased human ACE2 receptor binding affinity and infectivity. The RBD mutation analysis provides insights into SARS-CoV-2 evolution. The continuous surveillance of RBD mutations with increased human ACE2 affinity in human or other animals is important and necessary, particularly when the direct correlation between the virus variations and vaccine effectiveness is underdetermined during the sustained COVID-19 pandemic.",2020-03-17,microbiology,COVID-19,COVID-19
10.1101/2020.03.16.994152,Characterization of the SARS-CoV-2 Spike in an Early Prefusion Conformation,"Pandemic coronavirus disease 2019 (COVID-19) is caused by the emerging severe acute respiratory syndrome coronavirus 2 (SARS-CoV-2), for which there are no efficacious vaccines or therapeutics that are urgently needed. We expressed three versions of spike (S) proteins--receptor binding domain (RBD), S1 subunit and S ectodomain--in insect cells. RBD appears monomer in solutions, whereas S1 and S associate into homotrimer with substantial glycosylation. The three proteins confer excellent antigenicity with six convalescent COVID-19 patient sera. Cryo-electron microscopy (cryo-EM) analyses indicate that the SARS-CoV-2 S trimer dominate in a unique conformation distinguished from the classic prefusion conformation of coronaviruses by the upper S1 region at lower position ~15 [A] proximal to viral membrane. Such conformation is proposed as an early prefusion state for the SARS-CoV-2 spike that may broaden the knowledge of coronavirus and facilitate vaccine development.",2020-03-17,molecular biology,COVID-19,COVID-19
10.1101/2020.03.15.992883,A Cryptic Site of Vulnerability on the Receptor Binding Domain of the SARS-CoV-2 Spike Glycoprotein,"SARS-CoV-2 is a zoonotic virus that has caused a pandemic of severe respiratory disease--COVID-19-- within several months of its initial identification. Comparable to the first SARS-CoV, this novel coronaviruss surface Spike (S) glycoprotein mediates cell entry via the human ACE-2 receptor, and, thus, is the principal target for the development of vaccines and immunotherapeutics. Molecular information on the SARS-CoV-2 S glycoprotein remains limited. Here we report the crystal structure of the SARS-CoV-2 S receptor-binding-domain (RBD) at a the highest resolution to date, of 1.95 [A]. We identified a set of SARS-reactive monoclonal antibodies with cross-reactivity to SARS-CoV-2 RBD and other betacoronavirus S glycoproteins. One of these antibodies, CR3022, was previously shown to synergize with antibodies that target the ACE-2 binding site on the SARS-CoV RBD and reduce viral escape capacity. We determined the structure of CR3022, in complex with the SARS-CoV-2 RBD, and defined a broadly reactive epitope that is highly conserved across betacoronaviruses. This epitope is inaccessible in the ""closed"" prefusion S structure, but is accessible in ""open"" conformations. This first-ever resolution of a human antibody in complex with SARS-CoV-2 and the broad reactivity of this set of antibodies to a conserved betacoronavirus epitope will allow antigenic assessment of vaccine candidates, and provide a framework for accelerated vaccine, immunotherapeutic and diagnostic strategies against SARS-CoV-2 and related betacoronaviruses.

HIGHLIGHTSHigh resolution structure of the SARS-CoV-2 Receptor-Binding-Domain (RBD).

Recognition of the SARS-CoV-2 RBD by SARS-CoV antibodies.

Structure of the SARS-COV-2 RBD in complex with antibody CR3022.

Identification of a cryptic site of vulnerability on the SARS-CoV-2 Spike.",2020-03-17,immunology,COVID-19,COVID-19
10.1101/2020.03.15.993097,Cross-reactive antibody response between SARS-CoV-2 and SARS-CoV infections,"The World Health Organization has recently declared the ongoing outbreak of COVID-19, which is caused by a novel coronavirus SARS-CoV-2, as pandemic. There is currently a lack of knowledge in the antibody response elicited from SARS-CoV-2 infection. One major immunological question is concerning the antigenic differences between SARS-CoV-2 and SARS-CoV. We address this question by using plasma from patients infected by SARS-CoV-2 or SARS-CoV, and plasma obtained from infected or immunized mice. Our results show that while cross-reactivity in antibody binding to the spike protein is common, cross-neutralization of the live viruses is rare, indicating the presence of non-neutralizing antibody response to conserved epitopes in the spike. Whether these non-neutralizing antibody responses will lead to antibody-dependent disease enhancement needs to be addressed in the future. Overall, this study not only addresses a fundamental question regarding the antigenicity differences between SARS-CoV-2 and SARS-CoV, but also has important implications in vaccine development.",2020-03-17,microbiology,COVID-19,COVID-19
10.1101/2020.03.16.993816,Evidence of the Recombinant Origin and Ongoing Mutations in Severe Acute Respiratory Syndrome 2 (SARS-COV-2),"The recent global outbreak of viral pneumonia designated as Coronavirus Disease 2019 (COVID-19) by coronavirus (SARS-CoV-2) has threatened global public health and urged to investigate its source. Whole genome analysis of SARS-CoV-2 revealed ~96% genomic similarity with bat CoV (RaTG13) and clustered together in phylogenetic tree. Furthermore, RaTGl3 also showed 97.43% spike protein similarity with SARS-CoV-2 suggesting that RaTGl3 is the closest strain. However, RBD and key amino acid residues supposed to be crucial for human-to-human and cross-species transmission are homologues between SARS-CoV-2 and pangolin CoVs. These results from our analysis suggest that SARS-CoV-2 is a recombinant virus of bat and pangolin CoVs. Moreover, this study also reports mutations in coding regions of 125 SARS-CoV-2 genomes signifying its aptitude for evolution. In short, our findings propose that homologous recombination has been occurred between bat and pangolin CoVs that triggered cross-species transmission and emergence of SARS-CoV-2, and, during the ongoing outbreak, SARS-CoV-2 is still evolving for its adaptability.",2020-03-17,microbiology,COVID-19,COVID-19
10.1101/2020.03.15.992925,Master Regulator Analysis of the SARS-CoV-2/Human interactome,"the recent epidemic outbreak of a novel human coronavirus called SARS-CoV-2 and causing the respiratory tract disease COVID-19 has reached worldwide resonance and a global effort is being undertaken to characterize the molecular features and evolutionary origins of this virus. In this paper, we set out to shed light on the SARS-CoV-2/host receptor recognition, a crucial factor for successful virus infection. Based on the current knowledge of the interactome between SARS-CoV-2 and host cell proteins, we performed Master Regulator Analysis to detect which parts of the human interactome are most affected by the infection. We detected, amongst others, affected apoptotic and mitochondrial mechanisms, and a downregulation of the ACE2 protein receptor, notions that can be used to develop specific therapies against this new virus.",2020-03-17,bioinformatics,COVID-19,COVID-19
10.1101/2020.03.16.990317,Recapitulation of SARS-CoV-2 Infection and Cholangiocyte Damage with Human Liver Organoids,"The newly emerged pandemic coronavirus, SARS-CoV-2, has posed a significant public health threat worldwide. However, the mode of virus transmission and tissue tropism is not well established yet. Recent findings of substantial liver damage in patients and ACE2+ cholangiocytes in healthy liver tissues prompted us to hypothesize that human liver ductal organoids could serve as a model to determine the susceptibility and mechanisms underlining the liver damage upon SARS-CoV-2 infection. By single-cell RNA sequencing, we found that long-term liver ductal organoid culture preserved the human specific ACE2+ population of cholangiocytes. Moreover, human liver ductal organoids were permissive to SARS-CoV-2 infection and support robust replication. Notably, virus infection impaired the barrier and bile acid transporting functions of cholangiocytes through dysregulation of genes involved in tight junction formation and bile acid transportation, which could explain the bile acid accumulation and consequent liver damage in patients. These results indicate that control of liver damage caused directly by viral infection should be valued in treating COVID-19 patients. Our findings also provide an application of human organoids in investigating the tropism and pathogenesis of SARS-CoV-2, which would facilitate novel drug discovery.",2020-03-17,cell biology,COVID-19,COVID-19
10.1101/2020.03.16.993584,Multiple approaches for massively parallel sequencing of HCoV-19 genomes directly from clinical samples,"COVID-19 has caused a major epidemic worldwide, however, much is yet to be known about the epidemiology and evolution of the virus. One reason is that the challenges underneath sequencing HCoV-19 directly from clinical samples have not been completely tackled. Here we illustrate the application of amplicon and hybrid capture (capture)-based sequencing, as well as ultra-high-throughput metatranscriptomic (meta) sequencing in retrieving complete genomes, inter-individual and intra-individual variations of HCoV-19 from clinical samples covering a range of sample types and viral load. We also examine and compare the bias, sensitivity, accuracy, and other characteristics of these approaches in a comprehensive manner. This is, to date, the first work systematically implements amplicon and capture approaches in sequencing HCoV-19, as well as the first comparative study across methods. Our work offers practical solutions for genome sequencing and analyses of HCoV-19 and other emerging viruses.",2020-03-17,genomics,COVID-19,COVID-19
10.1101/2020.03.10.986711,Efficient inactivation of SARS-CoV-2 by WHO-recommended hand rub formulations and alcohols,"The recent emergence of Severe acute respiratory syndrome coronavirus 2 (SARS-CoV-2) causing COVID-19 is a major burden for health care systems worldwide. It is important to address if the current infection control instructions based on active ingredients are sufficient. We therefore determined the virucidal activity of two alcohol-based hand rub solutions for hand disinfection recommended by the World Health Organization (WHO), as well as commercially available alcohols. Efficient SARS-CoV-2 inactivation was demonstrated for all tested alcohol-based disinfectants. These findings show the successful inactivation of SARS-CoV-2 for the first time and provide confidence in its use for the control of COVID-19.

ImportanceThe current COVID-19 outbreak puts a huge burden on the worlds health care systems. Without effective therapeutics or vaccines being available, effective hygiene measure are of utmost importance to prevent viral spreading. It is therefore crucial to evaluate current infection control strategies against SARS-CoV-2. We show the inactivation of the novel coronavirus for the first time and endorse the importance of disinfectant-based hand hygiene to reduce SARS-CoV-2 transmission.",2020-03-17,microbiology,COVID-19,COVID-19
10.1101/2020.03.17.995639,"Comparative Pathogenesis Of COVID-19, MERS And SARS In A Non-Human Primate Model","A novel coronavirus, SARS-CoV-2, was recently identified in patients with an acute respiratory syndrome, COVID-19. To compare its pathogenesis with that of previously emerging coronaviruses, we inoculated cynomolgus macaques with SARS-CoV-2 or MERS-CoV and compared with historical SARS-CoV infections. In SARS-CoV-2-infected macaques, virus was excreted from nose and throat in absence of clinical signs, and detected in type I and II pneumocytes in foci of diffuse alveolar damage and mucous glands of the nasal cavity. In SARS-CoV-infection, lung lesions were typically more severe, while they were milder in MERS-CoV infection, where virus was detected mainly in type II pneumocytes. These data show that SARS-CoV-2 can cause a COVID-19-like disease, and suggest that the severity of SARS-CoV-2 infection is intermediate between that of SARS-CoV and MERS-CoV.

One Sentence SummarySARS-CoV-2 infection in macaques results in COVID-19-like disease with prolonged virus excretion from nose and throat in absence of clinical signs.",2020-03-17,microbiology,COVID-19,COVID-19
10.1101/2020.03.19.999318,The first-in-class peptide binder to the SARS-CoV-2 spike protein,"Coronavirus disease 19 (COVID-19) is an emerging global health crisis. With over 7 million confirmed cases to date, this pandemic continues to expand, spurring research to discover vaccines and therapies. SARS-CoV-2 is the novel coronavirus responsible for this disease. It initiates entry into human cells by binding to angiotensin-converting enzyme 2 (ACE2) via the receptor binding domain (RBD) of its spike protein (S). Disrupting the SARS-CoV-2-RBD binding to ACE2 with designer drugs has the potential to inhibit the virus from entering human cells, presenting a new modality for therapeutic intervention. Peptide-based binders are an attractive solution to inhibit the RBD-ACE2 interaction by adequately covering the extended protein contact interface. Using molecular dynamics simulations based on the recently solved cryo-EM structure of ACE2 in complex with SARS-CoV-2-RBD, we observed that the ACE2 peptidase domain (PD) 1 helix is important for binding SARS-CoV-2-RBD. Using automated fast-flow peptide synthesis, we chemically synthesized a 23-mer peptide fragment of the ACE2 PD 1 helix (SBP1) composed entirely of proteinogenic amino acids. Chemical synthesis of SBP1 was complete in 1.5 hours, and after work up and isolation >20 milligrams of pure material was obtained. Bio-layer interferometry (BLI) revealed that SBP1 associates with micromolar affinity to insect-derived SARS-CoV-2-RBD protein obtained from Sino Biological. Association of SBP1 was not observed to an appreciable extent to HEK cell-expressed SARS-CoV-2-RBD proteins and insect-derived variants acquired from other vendors. Moreover, competitive BLI assays showed SBP1 does not outcompete ACE2 binding to Sino Biological insect-derived SARS-CoV-2-RBD. Further investigations are ongoing to gain insight into the molecular and structural determinants of the variable binding behavior to different SARS-CoV-2-RBD protein variants.",2020-03-20,bioengineering,COVID-19,COVID-19
10.1101/2020.03.14.992156,Potential Neutralizing Antibodies Discovered for Novel Corona Virus Using Machine Learning,"The fast and untraceable virus mutations take lives of thousands of people before the immune system can produce the inhibitory antibody. Recent outbreak of novel coronavirus infected and killed thousands of people in the world. Rapid methods in finding peptides or antibody sequences that can inhibit the viral epitopes of COVID-19 will save the life of thousands. In this paper, we devised a machine learning (ML) model to predict the possible inhibitory synthetic antibodies for Corona virus. We collected 1933 virus-antibody sequences and their clinical patient neutralization response and trained an ML model to predict the antibody response. Using graph featurization with variety of ML methods, we screened thousands of hypothetical antibody sequences and found 8 stable antibodies that potentially inhibit COVID-19. We combined bioinformatics, structural biology, and Molecular Dynamics (MD) simulations to verify the stability of the candidate antibodies that can inhibit the Corona virus.",2020-03-20,immunology,COVID-19,COVID-19
10.1101/2020.03.17.995795,Scientometric Trends for Coronaviruses and Other Emerging Viral Infections,"COVID-19 is the most rapidly expanding coronavirus outbreak in the past two decades. To provide a swift response to a novel outbreak, prior knowledge from similar outbreaks is essential. Here, we study the volume of research conducted on previous coronavirus outbreaks, specifically SARS and MERS, relative to other infectious diseases by analyzing over 35 million papers from the last 20 years. Our results demonstrate that previous coronavirus outbreaks have been understudied compared to other viruses. We also show that the research volume of emerging infectious diseases is very high after an outbreak and drops drastically upon the containment of the disease. This can yield inadequate research and limited investment in gaining a full understanding of novel coronavirus management and prevention. Independent of the outcome of the current COVID-19 outbreak, we believe that measures should be taken to encourage sustained research in the field.",2020-03-20,microbiology,COVID-19,COVID-19
