doi,title,abstract,date,category,disease_label,keyword_used
10.1101/2020.04.21.047241,"Antigenicity, stability, and reproducibility of Zika reporter virus particles for long-term applications","The development of vaccines against flaviviruses, including Zika virus (ZIKV) and dengue virus (DENV), continues to be a major challenge, hindered by the lack of efficient and reliable methods for screening neutralizing activity of sera or antibodies. To address this need, we previously developed a plasmid-based, replication-incompetent DENV reporter virus particle (RVP) production system as an efficient and safe alternative to the Plaque Reduction Neutralization Test (PRNT). As part of the response to the 2015-2016 ZIKV outbreak, we recently developed pseudo-infectious ZIKV RVPs by modifying our DENV RVP system. The use of ZIKV RVPs as critical reagents in human clinical trials requires their further validation using stability and reproducibility metrics for large-scale applications. In the current study, we validated ZIKV RVPs using infectivity, neutralization, and enhancement assays with monoclonal antibodies (MAbs) and human ZIKV-positive patient serum. ZIKV RVPs are antigenically identical to live virus based on binding ELISA and neutralization results and are nonreplicating based on the results of plaque formation assays. We demonstrate reproducible neutralization titer data (NT50 values) across different RVP production lots, volumes, time frames, and laboratories. We also show RVP stability across experimentally relevant time intervals and temperatures. Our results demonstrate that ZIKV RVPs provide a safe, rapid, and reproducible reagent for large-scale, long-term studies of neutralizing antibodies and sera, which can facilitate large-scale screening and epidemiological studies to help expedite ZIKV vaccine development.

AUTHOR SUMMARYZIKV is a mosquito-borne virus that can cause severe birth defects and other disorders. Large outbreaks of ZIKV occurred in 2015 and 2016 and there are still no drugs or vaccines available to protect against ZIKV infection. Vaccine development has been hindered by the lack of safe and efficient methods to screen ZIKV neutralizing properties of patient sera or antibodies, especially in the context of large clinical trials. To address this unmet need, we developed and validated the use of ZIKV reporter virus particles (RVPs), a safe, high-throughput and quantitative alternative to using live virus for neutralization studies. We show that ZIKV RVPs are stable, show lot-to-lot consistency and provide reproducible neutralization data that is suitable for large-scale studies are needed for development of a ZIKV vaccine, epidemiologic surveillance, and high-throughput screening.",2020-04-22,microbiology,Dengue,Dengue
10.1101/2020.01.14.906297,Machine learning and dengue forecasting: Comparing random forests and artificial neural networks for predicting dengue burdens at the national sub-national scale in Colombia,"The robust estimate and forecast capability of random forests (RF) has been widely recognized, however this ensemble machine learning method has not been widely used in mosquito-borne disease forecasting. In this study, two sets of RF models were developed for the national and departmental levels in Colombia to predict weekly dengue cases at 12-weeks ahead. A national model based on artificial neural networks (ANN) was also developed and used as a comparator to the RF models. The various predictors included historic dengue cases, satellite-derived estimates for vegetation, precipitation, and air temperature, population counts, income inequality, and education. Our RF model trained on the national data was more accurate for department-specific weekly dengue cases estimation compared to a local model trained only on the departments data. Additionally, the forecast errors of the national RF model were smaller to those of the national ANN model and were increased with the forecast horizon increasing from one-week ahead (mean absolute error, MAE: 5.80; root mean squared error, RMSE: 11.10) to 12-weeks ahead (MAE: 13.38; RMSE: 26.82). There was considerable variation in the relative importance of predictors dependent on forecast horizon. The environmental and meteorological predictors were relatively important for short-term dengue forecast horizons while socio-demographic predictors were relevant for longer-term forecast horizons. This study showed the potential of RF in dengue forecasting with also demonstrating the feasibility of using a national model to forecast at finer spatial scales. Furthermore, sociodemographic predictors are important to include to capture longer-term trends in dengue.

Author summaryDengue virus has the highest disease burden of all mosquito-borne viral diseases, infecting 390 million people annually in 128 countries. Forecasting is an important warning mechanism that can help with proactive planning and response for clinical and public health services. In this study, we compare two different machine learning approaches to dengue forecasting: random forest (RF) and neural networks (NN). National and local (departmental-level) models were compared and used to predict dengue cases in the future. The results showed that the counts of future dengue cases were more accurately estimated by RF than by NN. It was also shown that environmental and meteorological predictors were more important for forecast accuracy for shorter-term forecasts while socio-demographic predictors were more important for longer-term forecasts. Finally, the national model applied to local data was more accurate in dengue forecasting compared to the local model. This research contributes to the field of disease forecasting and highlights different considerations for future forecasting studies.",2020-01-14,immunology,Dengue,Dengue
10.1101/2020.04.06.027706,Characterization of essential eggshell proteins from Aedes aegypti mosquitoes,"Up to 40% of the world population now live in areas where dengue mosquito vectors coexist with humans. Aedes aegypti are vectors for zoonotic diseases that affect hundreds of millions of individuals per year globally. We recently identified the eggshell organizing factor 1 (EOF1) protein using systematic RNA interference (RNAi) screening of mosquito lineage-specific genes. It was shown that eggs deposited by RNAi-EOF1 A. aegypti and A. albopictus mosquitoes were non-melanized, fragile, and contained nonviable embryos. Motivated by this discovery, we performed RNAi screening of eggshell proteins to determine putative downstream target proteins of intracellular EOF1. We identified several eggshell proteins as essential for eggshell formation in A. aegypti and characterized their phenotypes in detail by molecular and biochemical approaches. We found that Nasrat, Closca, and Polehole structural proteins, together with the Nudel serine protease, are indispensable for eggshell melanization and egg viability. While all four proteins are predominantly expressed in ovaries of adult females, Nudel mRNA expression is highly upregulated in response to blood feeding. Furthermore, we identified four secreted eggshell enzymes as important factors for controlling the processes of mosquito eggshell formation and melanization. These enzymes included three dopachrome converting enzymes and one cysteine protease. All eight characterized eggshell proteins were required for intact eggshell formation. However, their surface topologies in response to RNAi did not phenocopy the effect of RNAi-EOF1. Still, it remains unclear how EOF1 influences eggshell formation and melanization. The use of proteomic analysis of eggshell proteins from RNAi-EOF1 assisted in the identification of additional proteins that could be regulated in EOF1 deficient eggshells.",2020-04-07,developmental biology,Dengue,Dengue
10.1101/2020.04.04.025163,A benzene-mapping approach for uncovering cryptic pockets in membrane-bound proteins,"Molecular dynamics (MD) simulations in combination with small organic probes present in the solvent have previously been used as a method to reveal cryptic pockets that may not have been identified in experimental structures. We report such a method implemented within the CHARMM forcefield to effectively explore cryptic pockets on the surfaces of membrane-embedded proteins using benzene as a probe molecule. This relies on modified non-bonded parameters in addition to repulsive potentials between membrane lipids and benzene molecules. The method was tested on part of the outer shell of the dengue virus (DENV), for which research into a safe and effective neutralizing antibody or drug molecule is still ongoing. In particular, the envelope (E) protein, associated with the membrane (M) protein, is a lipid membrane-embedded complex which forms a dimer in the mature viral envelope. Solvent mapping was performed for the full, membrane-embedded EM protein complex and compared with similar calculations performed for the isolated, soluble E protein ectodomain dimer in solvent. Ectodomain-only simulations with benzene exhibited unfolding effects not observed in the more physiologically relevant membrane-associated systems. A cryptic pocket which has been experimentally shown to bind n-octyl-{beta}-D-glucoside detergent was consistently revealed in all benzene-containing simulations. The addition of benzene also enhanced the flexibility and hydrophobic exposure of cryptic pockets at a key, functional interface in the E protein, and revealed a novel, potentially druggable pocket that may be targeted to prevent conformational changes associated with viral entry into the cell.

GRAPHICAL ABSTRACT

O_FIG O_LINKSMALLFIG WIDTH=200 HEIGHT=131 SRC=""FIGDIR/small/025163v1_ufig1.gif"" ALT=""Figure 1"">
View larger version (73K):
org.highwire.dtl.DTLVardef@abe537org.highwire.dtl.DTLVardef@155a741org.highwire.dtl.DTLVardef@57bff6org.highwire.dtl.DTLVardef@fbee3a_HPS_FORMAT_FIGEXP  M_FIG C_FIG",2020-04-05,biophysics,Dengue,Dengue
10.1101/2020.09.14.295915,Fusion and fission events regulate endosome maturation and viral escape,"Many intra-cellular processes rely on transport by endosomes. Recent experimental techniques have provided insights into organelle maturation and its specific role in, for instance, the ability of a virus to escape an endosome and release its genetic material in the cytoplasm. Endosome maturation and dynamics depend on GTPases called Rabs, found on their membrane. Here, we introduce a mathematical framework, combining coagulation and fragmentation of endosomes with two variables internal to each organelle, to model endosomes as intra-cellular compartments characterised by their levels of (active) Rab5 and Rab7. The key element in our framework is the ""per-cell endosomal distribution"" and its its dynamical equation or Boltzmann equation. The Boltzmann equation, then, allows one to deduce simple equations for the total number of endosomes in a cell, and for the mean and standard deviation of the Rab5 and Rab7 levels. We compare our solutions with experimental data sets of Dengue viral escape from endosomes. The relationship between endosomal Rab levels and pH suggests a mechanism which can account for the observed variability in viral escape times, which in turn regulate the viability of a viral intra-cellular infection.

Author summaryEndosomes are intra-cellular receptacle-like organelles, which transport endocytosed cargo upon internalisation from the plasma membrane. These early endosomes, also known as sorting endosomes, mature to late endosomes, with a lower pH than early ones, as a consequence of the intricate dynamics of a family of molecules called Rabs. Viruses exploit this endosomal pH drop to their advantage. Here we bring together experimental data on Dengue viral escape times from endosomes and a novel mathematical framework inspired by the theory of droplet coalescence, to improve our understanding of endosome maturation, and in turn to quantify the large variability of viral escape times. This mathematical framework can easily be generalised to model the dynamics of other intra-cellular organelles, such as mitochondria or the endoplasmic reticulum.",2020-09-14,systems biology,Dengue,Dengue
10.1101/2020.03.01.972026,"JNK pathway restricts DENV, ZIKV and CHIKV infection by activating complement and apoptosis in mosquito salivary glands","Arbovirus infection of Aedes aegypti salivary glands (SGs) determines transmission. However, there is a dearth of knowledge on SG immunity. Here, we characterized SG immune response to dengue, Zika and chikungunya viruses using high-throughput transcriptomics. The three viruses regulate components of Toll, IMD and JNK pathways. However, silencing of Toll and IMD components showed variable effects on SG infection by each virus. In contrast, regulation of JNK pathway produced consistent responses. Virus infection increased with depletion of component Kayak and decreased with depletion of negative regulator Puckered. Virus-induced JNK pathway regulates complement and apoptosis in SGs via TEP20 and Dronc, respectively. Individual and co-silencing of these genes demonstrate their antiviral effects and that both may function together. Co-silencing either TEP20 or Dronc with Puckered annihilates JNK pathway antiviral effect. We identified and characterized the broad antiviral function of JNK pathway in SGs, expanding the immune arsenal that blocks arbovirus transmission.",2020-03-03,microbiology,Dengue,Dengue
10.1101/768549,Heterogeneous genetic invasions of three insecticide resistance mutations in Indo-Pacific populations of Aedes aegypti (L.),"Nations throughout the Indo-Pacific region use pyrethroid insecticides to control Aedes aegypti, the mosquito vector of dengue, often without knowledge of pyrethroid resistance status of the pest or origin of resistance. Two mutations (V1016G + F1534C) in the sodium channel gene (Vssc) of Ae. aegypti modify ion channel function and cause target-site resistance to pyrethroid insecticides, with a third mutation (S989P) having a potential additive effect. Of 27 possible genotypes involving these mutations, some allelic combinations are never seen while others predominate. Here, five allelic combinations common in Ae. aegypti from the Indo-Pacific region are described and their geographical distributions investigated using genome-wide SNP markers. We tested the hypothesis that resistance allele combinations evolved de novo in populations, versus the alternative that dispersal of Ae. aegypti between populations facilitated genetic invasions of allele combinations. We used latent factor mixed-models to detect SNPs throughout the genome that showed structuring in line with resistance allele combinations and compared variation at SNPs within the Vssc gene with genome-wide variation. Mixed-models detected an array of SNPs linked to resistance allele combinations, all located within or in close proximity to the Vssc gene. Variation at SNPs within the Vssc gene was structured by resistance profile, while genome-wide SNPs were structured by population. These results demonstrate that alleles near to resistance mutations have been transferred between populations via linked selection. This indicates that genetic invasions have contributed to the widespread occurrence of Vssc allele combinations in Ae. aegypti in the Indo-Pacific region, pointing to undocumented mosquito invasions between countries.",2020-03-18,evolutionary biology,Dengue,Dengue
10.1101/2020.05.13.094136,DENV NS1 and MMP-9 cooperate to induce vascular leakage by altering endothelial cell adhesion and tight junction,"Dengue virus (DENV) is a mosquito-borne pathogen that causes a spectrum of diseases including life-threatening dengue hemorrhagic fever (DHF) and dengue shock syndrome (DSS). Vascular leakage is a common clinical crisis in DHF/DSS patients which is closely associated with increased endothelial permeability. The presence of vascular leakage causes hypotension, circulatory failure or disseminated intravascular coagulation as the disease progresses, which can lead to death under such conditions. However, the mechanisms by which DENV infection caused the vascular leakage are not fully understood. This study reveals a distinct mechanism by which DENV induces endothelial permeability and vascular leakage in human endothelial cells and mice tissues. We initially show that DENV2 promotes the matrix metalloproteinase-9 (MMP-9) expression and secretion in DHF patient serum, peripheral blood mononuclear cells (PBMCs) and macrophages, and further reveal that DENV non-structural protein 1 (NS1) induces MMP-9 expression through activating the nuclear factor {kappa}B (NF-{kappa}B) signaling pathway. Additionally, NS1 inhibits TIMP-1 expression to facilitates the MMP-9 enzymatic activity which alters the adhesion and tight junctions and vascular leakage in human endothelial cells and mouse tissues. Moreover, NS1 recruits MMP-9 to interact with {beta}-catenin and Zona occludins protein-1/2 to degrade the important adhesion and tight junction proteins, thereby inducing endothelial hyperpermeability and vascular leakage in human endothelial cells and mouse tissues. Thus, we reveal that DENV NS1 and MMP-9 cooperatively induce vascular leakage by impairing endothelial cell adhesion and tight junction, and suggest that MMP-9 may serve as a potential target for the treatment of hypovolemia in DSS/DHF patients.

Author SummaryDENV is the most common mosquito-transmitted viral pathogen in humans. In general, DENV-infected patients are either asymptomatic or have flu-like symptoms with fever and rash. However, in severe cases of DENV infection, the disease may progress to dengue hemorrhagic fever (DHF) or dengue shock syndrome (DSS), the leading causes of morbidity and mortality in school-age children in tropical and subtropical regions. DENV-induced vascular leakage is characterized by enhanced vascular permeability without morphological damage to the capillary endothelium. We found that a distinct mechanism of DENV NS1 and MMP-9 cooperatively induce vascular leakage is the main reason leading to death in severe dengue patients. Also, NS1 recruits MMP-9 to degrade {beta}-catenin, ZO-1, ZO-2 to intervene endothelial hyperpermeability in human endothelial cells and mouse vascular. Finally, we reveal that DENV activating NF-{kappa}B signaling pathway induces MMP-9 expression, in patients, mice, PBMC and macrophages though the viral NS1 protein. This study would provide new in signs into the pathogenesis caused by DENV infection, and suggest that MMP-9 may acts as a drug target for the prevention and treatment of DENV-associated diseases.",2020-05-13,microbiology,Dengue,Dengue
10.1101/2020.06.07.138669,A high resolution view of an adolescent flavivirus,"Mosquito-transmitted flaviviruses, such as Dengue virus (DENV) or Zika virus (ZIKV), are responsible for significant economic damage and human misery. In infected cells, flaviviruses first assemble into an immature form within the endoplasmatic reticulum (ER), and then undergo further processing by furin protease in the trans-Golgi. Despite substantial efforts, previous cryogenic electron microscopy (cryo-EM) studies of immature flaviviruses were restricted to low to medium resolutions, limiting our understanding of maturation. To better grasp the process of maturation, we have carried out cryo-EM reconstructions of immature Spondweni virus (SPOV), an emerging human flavivirus belonging to the same serogroup as ZIKV (~75% amino acid identity). By combining localized reconstruction and focused refinement, we were able to improve the resolution to 3.8 [A], yielding unprecedented insight into the immature form. The structure elucidates how, at neutral pH, polar interactions conceal the furin recognition site within trimeric envelope (E) protein spikes. Furthermore, we identify how a strictly conserved pH sensor anchors the precursor membrane (prM) protein to immature E. We reconstructed mature forms of SPONV and DENV to 2.6[A] and 3.1[A], respectively. Comparison with immature virus shows a conserved binding pocket for a lipid headgroup, which forms as a consequence of the rearrangement of amphipathic stem-helices of E. We propose a structural role for the pocket and suggest it stabilizes mature E. Taken together, our data suggest a compelling rationale for low-pH triggered conformational rearrangement in the Golgi, which occurs during flavivirus maturation.",2020-06-07,microbiology,Dengue,Dengue
10.1101/2020.01.16.908830,"Serological evidence of exposure to Rift Valley, Dengue and Chikungunya Viruses among agropastoral communities in Manyara and Morogoro regions in Tanzania: A community Survey","IntroductionTanzania has recently experienced outbreaks of dengue in two coastal regions of Dar es Salaam and Tanga. Chikungunya and Rift Valley Fever outbreaks have also been recorded in the past decade. Little is known on the burden of the arboviral disease causing viruses (Dengue, Rift Valley and Chikungunya) endemically in the inter-epidemic periods. We aimed at determining the prevalence of the dengue, rift valley and chikungunya among humans in two geo ecologically distinct sites.

MethodologyThe community-based cross-sectional study was conducted in Magugu in Manyara region and Mvomero in Morogoro region in Tanzania. Venous blood was collected from participants of all age groups, serum prepared from samples and subjected to ELISA tests for RVFV IgG/IgM, DENV IgG/IgM, and CHIKV IgM/IgG. Samples that were positive for IgM ELISA tests were subjected to a quantitative RT PCR for each virus. A structured questionnaire was used to collect socio-demographic information. Data analysis was conducted using SPSSv22.

ResultsA total of 191 individuals from both sites participated in the study. Only one CHIKV was detected in Magugu site but none of the 69 participants from Magugu site was seropositive or positive for RVFV and DENV. Of the 122 individuals from Wami-Dakawa site, 16.39% (n=20) had recent exposure to RVFV while 9.83% (n=12) were recently infected by Chikungunya virus. All samples were negative by RVFV and CHIKV qPCR. Neither Infection nor exposure to DENV was observed in participants from Wami-Dakawa. Risk factors associated with RVFV and DCHIKV seropositivity were being more than 5 in a household, having no formal education and having recently travelled to an urban area.

ConclusionWe report an active circulation of RVFV and CHIKV in humans in Wami-Dakawa, in Mvomero district of Morogoro region during dry season, a higher rate of exposure to RVFV compared to CHIKV and an absence of circulating RVFV, DENV and CHIKV in humans in Magugu site in Manyara region.

Author SummaryDengue, Chikungunya, rift valley and other viruses constitute an important group of etiologies of fever in Tanzania. In the past decade, Tanzania has experienced DENV and RVFV at different times. While RVFV outbreaks have occurred cyclically in approximately ten-year periods in Tanzania, DENV outbreaks have been more frequent since 2010. CHIKV infection is an important but largely unrecognized illness in Tanzania. In this study, we aimed to generate baseline data on the exposure and infection status of DENV, RVFV and CHIKV by detecting antibodies to the viruses and detecting the viruses in human subjects in two geo-ecological distinct sites. Neither infection nor exposure to the viruses were in observed in Magugu site in Manyara region, northern Tanzania. There was a significant exposure to RVFV (16.39%) and CHIKV (9.83%) in Wami-Dakawa but not to DENV in either site. None of the viruses was detected by PCR in any of the sites. Potential risks for exposure to CHIKV and RVFV were Larger numbers of household members, having no formal education and having recently travelled to an urban destination. Since arbovirus outbreaks are usually unpredictable, it is crucial to undertake active surveillance for RVFV, DENV, CHIKV and other viral agents in Tanzania.",2020-01-16,microbiology,Dengue,Dengue
