doi,title,abstract,date,category,disease_label,keyword_used
10.1101/2020.01.10.902668,The rifampicin-inactivating mono-ADP-ribosyl transferase of Mycobacterium smegmatis significantly influences reactive oxygen species levels in the actively growing cells,"A classic example of antibiotic inactivating function in bacteria is the Mycobacterium smegmatis (Msm) encoded rifampicin-inactivating mono-ADP-ribosyl transferase (arr). Since its probable biological role has been proposed to be in DNA damage response, which is inflicted by reactive oxygen species (ROS), in the present study, we examined whether Msm Arr influences ROS levels. For this purpose, the levels of the ROS, hydroxyl radical and superoxide, were determined in the mid-log phase (MLP) cells of Msm arr knockout (arr-KO) strain, in comparison to those in the equivalently grown Msm arr+ wild-type (WT) strain. The MLP arr-KO cells generated significantly elevated levels of superoxide and hydroxyl radical, unlike the equivalently grown WT MLP cells. Complementation of arr-KO with arr, but not with empty vector, restored the ROS levels comparable to those in the WT strain. Elevated ROS levels in the arr-KO strain enabled selection of rifampicin-resistant mutants at 10-7 cfu/ml from the rifampicin-unexposed MLP cells of arr-KO, which is one-log10 higher than that for WT cells (10-8). Upon prolonged exposure to rifampicin, the susceptibility, persister formation, generation of elevated levels of hydroxyl radical by the persisters, rifampicin-resister generation frequency of the persisters and regrowth of the rifampicin-resistant mutants from the respective persisters were all comparable between the arr-KO and WT strains. These observations revealed that Arr influences ROS levels in the actively growing M. smegmatis cells but not in the rifampicin-exposed cells. We proposed the probable pathway through which Arr might be influencing ROS levels in the actively growing M. smegmatis cells.

IMPORTANCEDiverse genera of bacteria consisting of pathogens, opportunistic pathogens and non-pathogens, possess Arr-type activities that confer equally efficient rifampicin resistance, thereby posing serious health hazard. Acquisition of this function by other bacteria through horizontal gene transfer enhances the hazard posed by the bacteria possessing it. M. smegmatis is an opportunistic human pathogen that causes infections of skin and soft tissues. Moreover, M. smegmatis is a genetically tractable model organism for M. tuberculosis with the potential to function even as tuberculosis vaccine. In view of these significant aspects of Arr and M. smegmatis, the study to find out the natural physiological role of Arr in M. smegmatis, gains importance for designing strategies to prevent antibiotic inactivation and to target the cellular function to contain the bacterium. Above all, the three-dimensional structure of M. smegmatis Arr reveals significant structural homology with eukaryotic ADP-ribosyltransferases and bacterial toxins, thereby giving the study broad significance.",2020-01-11,microbiology,Tuberculosis,Tuberculosis
10.1101/561506,Dual acting small-Molecule inhibitors targeting Mycobacterial DNA replication,"Mycobacterium tuberculosis (Mtb) is a pathogenic bacterium and a causative agent of tuberculosis (TB), a disease that kills more than 1.5 million people worldwide annually. One of the main reasons for this high mortality rate is the evolution of new Mtb strains that are resistant to available antibiotics. Therefore, new therapeutics for TB are in constant demand. Here we report the development of such inhibitors that target two DNA replication enzymes of Mtb, namely DnaG primase and DNA gyrase, which share a conserved TOPRIM fold near the inhibitors binding site. The molecules were developed on the basis of previously reported inhibitors for T7 DNA primase that bind near the TOPRIM fold. In order to improve the physicochemical properties of the molecules as well as their inhibitory effect on primase and gyrase, 49 novel compounds were synthesized as potential drug candidates in three stages of optimization. The last stage of chemical optimization yielded two novel inhibitors for the fast-growing nonpathogenic model Mycobacterium smegmatis (Msmg).",2020-02-03,biochemistry,Tuberculosis,Tuberculosis
10.1101/2020.01.28.922989,Producing Polished Prokaryotic Pangenomes with the Panaroo Pipeline,"Population-level comparisons of prokaryotic genomes must take into account the substantial differences in gene content, resulting from frequent horizontal gene transfer, gene duplication and gene loss. However, the automated annotation of prokaryotic genomes is imperfect, and errors due to fragmented assemblies, contamination, diverse gene families and mis-assemblies accumulate over the population, leading to profound consequences when analysing the set of all genes found in a species. Here we introduce Panaroo, a graph based pangenome clustering tool that is able to account for many of the sources of error introduced during the annotation of prokaryotic genome assemblies. We verified our approach through extensive simulations of de novo assemblies using the infinitely many genes model and by analysing a number of publicly available large bacterial genome datasets. Using a highly clonal Mycobacterium tuberculosis dataset as a negative control case, we show that failing to account for annotation errors can lead to pangenome estimates that are dominated by error. We additionally demonstrate the utility of the improved graphical output provided by Panaroo by performing a pan-genome wide association study in Neisseria gonorrhoeae and by analysing gene gain and loss rates across 51 of the major global pneumococcal sequence clusters. Panaroo is freely available under an open source MIT licence at https://github.com/gtonkinhill/panaroo.",2020-01-28,genomics,Tuberculosis,Tuberculosis
10.1101/2020.02.20.950329,Revisiting the expression signature of pks15/1 unveils regulatory patterns controlling phenolphtiocerol and phenolglycolipid production in pathogenic mycobacteria,"One of the most relevant and exclusive characteristics of mycobacteria is its cell wall, composed by mycolic acids. Amid these are two related families of glycosylated lipids, diphthioceranates and phthiocerol dimycocerosate (PDIM) and its variant phenolic glycolipids (PGL). PGL have been associated with cell wall impermeability, phagocytosis, defence against nitrosative and oxidative stress and, supposedly, biofilm formation. In bacteria from the Mycobacterium tuberculosis complex, the biosynthetic pathway of the phenolphthiocerol moiety of PGL depends upon the expression of several genes encoding type I polyketide synthases (PKS), namely ppsA-E and pks15/1 constituting the PDIM + PGL locus, highly conserved in PDIM/PGL-producing strains. Consensus has not been achieved regarding the genetic organization of pks15/1 locus and little effort has been put on the disclosure of its transcriptional signature. Here we explore publicly available datasets of transcriptome data (RNA-seq) from more than 100 experiments in 40 growth conditions to outline the transcriptional structure and signature of pks15/1 and use a differential expression approach to infer the regulatory patterns involving these and related genes. We show that pks1 is highly correlated with fadD22, Rv2949c, lppX, fadD29 and, also, pks6 and pks12, with the first three putatively integrating a polycistronic structure. We evidence dynamic heterogeneity of transcription within the genes involved in phenolphtiocerol and phenolglycolipid production, most exhibiting up-regulation upon acidic pH and antibiotic exposure and down-regulation under hypoxia, dormancy, and low/high iron concentration. We finally propose a model based on transcriptome data in which {sigma}D positively regulates pks1, pks15 and fadD22, while {sigma}B and {sigma}E factors exert negative regulation at an upper level.",2020-02-20,genomics,Tuberculosis,Tuberculosis
10.1101/2020.05.13.092585,Phthiocerol dimycocerosates from Mycobacterium tuberculosis increase the membrane activity of bacterial effectors and host receptors,"Mycobacterium tuberculosis (Mtb) synthesizes a variety of atypical lipids that are exposed at the cell surface and help the bacterium infect macrophages and escape elimination by the cells immune responses. In the present study, we investigate the mechanism of action of one family of hydrophobic lipids, the phthiocerol dimycocerosates (DIM/PDIM), major lipid virulence factors. DIM are transferred from the envelope of Mtb to host membranes during infection. Using the polarity-sensitive fluorophore C-Laurdan, we visualized that DIM increase the membrane polarity of a supported lipid bilayer put in contact with mycobacteria, even beyond the site of contact. We observed that DIM activate the complement receptor 3, a predominant receptor for phagocytosis of Mtb by macrophages. DIM also increased the activity of membrane-permeabilizing effectors of Mtb, among which the virulence factor EsxA. This is consistent with previous observations that DIM help Mtb disrupt host cell membranes. Taken together, our data show that transferred DIM spread within the target membrane, remodel lipid organization and increase the activity of host cell receptors and bacterial effectors, diverting in a nonspecific manner host cell functions. We therefore bring new insight into the molecular mechanisms by which DIM increase Mtbs capability to escape the cells immune responses.",2020-05-14,microbiology,Tuberculosis,Tuberculosis
10.1101/691808,Channeling macrophage polarization via selective translation inhibition by rocaglates increases macrophage resistance to Mycobacterium tuberculosis,"Macrophages contribute to host immunity and tissue homeostasis via alternative activation programs. M1-like macrophages control intracellular bacterial pathogens and tumor progression. In contrast, M2-like macrophages shape reparative microenvironments that can be conducive for pathogen survival or tumor growth. An imbalance of these macrophages phenotypes may perpetuate sites of chronic unresolved inflammation, such as infectious granulomas and solid tumors.

We have found that plant-derived and synthetic rocaglates sensitize macrophages to low concentrations of the M1-inducing cytokine IFN-gamma and inhibit their responsiveness to IL-4, a prototypical activator of the M2-like phenotype. Treatement of primary macrophages with rocaglates increased their resilience to oxidative stress, stimulated autophagy and killing of intracellular mycobacteria. Thus, rocaglates represent a novel class of immunomodulators that can direct macrophage polarization towards the M1-like phenotype in complex microenvironments associated with hypofunction of type 1 and/or hyperactivation of type 2 immunity, e.g. chronic bacterial infections, allergies and, possibly, certain tumors.",2020-08-31,immunology,Tuberculosis,Tuberculosis
10.1101/2020.01.07.897447,"MAIT cells are minimally responsive to Mycobacterium tuberculosis within granulomas, but are functionally impaired by SIV in a macaque model of SIV and Mtb co-infection","Mucosal associated invariant T (MAIT) cells recognize and can directly destroy bacterially infected cells. While a role for MAIT cells has been suggested in several in vitro and in vivo models of M.tuberculosis (Mtb) infection, these studies have often focused on MAIT cells within the peripheral blood or are cross-sectional studies rather than longitudinal studies. The role of MAIT cells within granulomas and other sites of Mtb infection is relatively unknown. Furthermore, how HIV/SIV infection might impair MAIT cells at the sites of Mtb infection has not been determined. Using a Mauritian cynomolgus macaque (MCM) model system, we phenotyped MAIT cells in the peripheral blood and BAL prior to and during infection with SIVmac239. To characterize the role of MAIT cells within granulomas, SIV+ and -naive MCM were infected with a low dose of Mtb for 6 weeks. MAIT cell frequency and function was examined within the peripheral blood, distal airways, as well as within Mtb-affected lymph nodes (LN) and tissues. Surprisingly, we found no evidence of MAIT cell responsiveness to Mtb within granulomas. Additionally, MAIT cells only minimally responded to mycobacterial stimulus in ex vivo functional assays. In contrast, most MAIT cell activation seemed to occur in samples with highly active SIV replication, including blood and SIV-infected LN. Finally, the ability of MAIT cells to secrete TNF (TNF) was impaired during SIV and Mtb co-infection, indicating that the two pathogens together could have a synergistically deleterious effect on MAIT cell function. The effect of this functional impairment on overall TB disease burden was unclear, but might be deleterious if MAIT cells are needed to fully activate antimycobacterial immune cells within the granulomas.",2020-01-08,immunology,Tuberculosis,Tuberculosis
10.1101/2020.03.16.994244,A RNA-seq characterization of the porcine sperm microbiome.,"The microbiome plays a key role in homeostasis and health and it has been also linked to fertility and semen quality in several animal species including swine. Despite the more than likely importance of sperm bacteria on the boars reproductive ability and the dissemination of pathogens and antimicrobial resistance genes, a high throughput characterization of the swine sperm microbiome remains undone. The current study aimed at profiling the boar sperm bacterial population and its relationship with seven semen quality traits.

We carried RNA-seq on 40 ejaculates and we found that it contains a broad population of bacteria. The most abundant phyla were Proteobacteria (39.1%), Firmicutes (27.5%), Actinobacteria (14.9%) and Bacteroidetes (5.7%). The predominant species contaminated sperm after ejaculation from soil, faeces and water sources (Bacillus megaterium, Brachybacterium faecium, Bacillus coagulans). Some potential pathogens were also found but at relatively low levels (Escherichia coli, Clostridioides difficile, Clostridium perfringens, Clostridium botulinum and Mycobacterium tuberculosis). We also identified 3 potential antibiotic resistant genes from E. coli against chloramphenicol, Neisseria meningitidis against spectinomycin and Staphylococcus aureus against linezolid. None of these genes were highly abundant. Finally, we classified the ejaculates into categories according to their bacterial features and semen quality parameters and identified two categories that significantly differed for 5 semen quality traits and 13 bacterial features including the genera Acinetobacter, Stenotrophomonas and Rhodobacter. Our results show that boar semen contains a rich microbiome with potential pathogens and antibiotic resistance genes which may affect its reproductive performance.",2020-03-18,genomics,Tuberculosis,Tuberculosis
10.1101/2020.04.22.055178,"In silico discovery and biological validation of ligands of FAD synthase, a promising new antimicrobial target","New treatments for diseases caused by antimicrobial-resistant microorganisms can be developed by identifying unexplored therapeutic targets and by designing efficient drug screening protocols. In this study, we have screened a library of compounds to find ligands for the flavin-adenine dinucleotide synthase (FADS) -a potential target for drug design against tuberculosis and pneumonia- by implementing a new and efficient virtual screening protocol. The protocol has been developed for the in silico search of ligands of unexplored therapeutic targets, for which limited information about ligands or ligand-receptor structures is available. It implements an integrative funnel-like strategy with filtering layers that increase in computational accuracy. The protocol starts with a pharmacophore-based virtual screening strategy that uses ligand-free receptor conformations from molecular dynamics (MD) simulations. Then, it performs a molecular docking stage using several docking programs and an exponential consensus ranking strategy. The last filter, samples the conformations of compounds bound to the target using MD simulations. The MD conformations are scored using several traditional scoring functions in combination with a newly-proposed score that takes into account the fluctuations of the molecule with a Morse-based potential. The protocol was optimized and validated using a compound library with known ligands of the Corynebacterium ammoniagenes FADS. Then, it was used to find new FADS ligands from a compound library of 14,000 molecules. A small set of 17 in silico filtered molecules were tested experimentally. We identified five inhibitors of the activity of the flavin adenylyl transferase mononucleotide of the FADS, and some of them were able to inhibit growth of three bacterial species: Corynebacterium ammoniagenes, Mycobacterium tuberculosis, and Streptococcus pneumoniae, where the former two are human pathogens. Overall, the results show that the integrative VS protocol is a cost-effective solution for the discovery of ligands of unexplored therapeutic targets.

Author summaryDeveloping cures for antimicrobial-resistant microorganisms is a pressing necessity. Addressing this problem requires the discovery of novel therapeutic targets -for example, bacterial proteins with no human homologues- and the development of cost-effective drug screening protocols. In this work, we tackled the problem on both sides. We developed an efficient and successful integrative computational protocol for screening inhibitory-molecules for unexplored targets. We used it to discover five novel inhibitors of flavin-adenine dinucleotide synthase (FADS), a promising protein target of pathogens causing tuberculosis and pneumonia.",2020-04-22,biophysics,Tuberculosis,Tuberculosis
10.1101/2020.04.29.068254,Predicting Antimicrobial Resistance Using Conserved Genes,"A growing number of studies have shown that machine learning algorithms can be used to accurately predict antimicrobial resistance (AMR) phenotypes from bacterial sequence data. In these studies, models are typically trained using input features derived from comprehensive sets of known AMR genes or whole genome sequences. However, it can be difficult to determine whether genomes and their corresponding sets of AMR genes are complete when sequencing contaminated or metagenomic samples. In this study, we explore the possibility of using incomplete genome sequence data to predict AMR phenotypes. Machine learning models were built from randomly-selected sets of core genes that are held in common among the members of a species, and the AMR-conferring genes were removed based on their protein annotations. For Klebsiella pneumoniae, Mycobacterium tuberculosis, Salmonella enterica, and Staphylococcus aureus, we report that it is possible to classify susceptible and resistant phenotypes with average F1 scores ranging from 0.80-0.89 with as few as 100 conserved non-AMR genes, with very major error rates ranging from 0.11-0.23 and major error rates ranging from 0.10-0.20. Models built from core genes have predictive power in the cases where the primary AMR mechanism results from SNPs or horizontal gene transfer. By randomly sampling non-overlapping sets of core genes for use in these models, we show that F1 scores and error rates are stable and have little variance between replicates. Potential biases from strain-specific SNPs, phylogenetic sampling, and imbalances in the phylogenetic distribution of susceptible and resistant strains do not appear to have an impact on this result. Although these small core gene models have lower accuracies and higher error rates than models built from the corresponding assembled genomes, the results suggest that sufficient variation exists in the core non-AMR genes of a species for predicting AMR phenotypes. Overall this study suggests that building models from conserved genes may be a potentially useful strategy for predicting AMR phenotypes when genomes are incomplete.",2020-04-29,bioinformatics,Tuberculosis,Tuberculosis
10.1101/2020.04.23.057828,Multimodal memory T cell profiling identifies a reduction in a polyfunctional Th17 state associated with tuberculosis progression,"Mycobacterium tuberculosis (M.tb) results in 10 million active tuberculosis (TB) cases and 1.5 million deaths each year1, making it the worlds leading infectious cause of death2. Infection leads to either an asymptomatic latent state or TB disease. Memory T cells have been implicated in TB disease progression, but the specific cell states involved have not yet been delineated because of the limited scope of traditional profiling strategies. Furthermore, immune activation during infection confounds underlying differences in T cell state distributions that influence risk of progression. Here, we used a multimodal single-cell approach to integrate measurements of transcripts and 30 functionally relevant surface proteins to comprehensively define the memory T cell landscape at steady state (i.e., outside of active infection). We profiled 500,000 memory T cells from 259 Peruvians > 4.7 years after they had either latent M.tb infection or active disease and defined 31 distinct memory T cell states, including a CD4+CD26+CD161+CCR6+ effector memory state that was significantly reduced in patients who had developed active TB (OR = 0.80, 95% CI: 0.73-0.87, p = 1.21 x 10-6). This state was also polyfunctional; in ex vivo stimulation, it was enriched for IL-17 and IL-22 production, consistent with a Th17-skewed phenotype, but also had more capacity to produce IFN{gamma} than other CD161+CCR6+ Th17 cells. Additionally, in progressors, IL-17 and IL-22 production in this cell state was significantly lower than in non-progressors. Reduced abundance and function of this state may be an important factor in failure to control M.tb infection.",2020-04-25,immunology,Tuberculosis,Tuberculosis
10.1101/2020.04.04.025411,Mycobacterium tuberculosis stimulates IL-1 production by macrophages in an ESAT-6 dependent manner with the involvement of serum amyloid A3,"To explore interleukin (IL)-1{beta} production in tuberculosis, we infected mouse bone marrow-derived macrophages (BMDM) with Mycobacterium tuberculosis (Mtb) H37Rv, its early secreted antigenic target protein of 6 kDa (ESAT-6) gene deletion (H37Rv:{Delta}3875) or complemented strain (H37Rv:{Delta}3875C) and evaluated IL-1{beta} production. H37Rv induced significantly increased IL-1{beta} production by BMDMs compared to non-infected BMDMs. In contrast, H37Rv:{Delta}3875 induced significantly less mature IL-1{beta} production despite eliciting comparable levels of pro-IL-1{beta} and IL-8 from BMDMs compared to H37Rv and H37Rv:{Delta}3875C. Blocking either NLRP3 or K+ efflux diminished H37Rv-induced IL-1{beta} production by BMDMs. Infection of mice intranasally with H37Rv:{Delta}3875 induced less IL-1{beta} production in the lungs compared with H37Rv.Intranasal delivery of ESAT-6 but not CFP10 induced production of IL-1{beta} in mouse lungs and RNA-Seq analysis identified serum amyloid A (SAA) 3 as one of the highly expressed genes in mouse lungs. Infection of mice with H37Rv but not H37Rv:{Delta}3875 induced expression of lung SAA3 mRNA and protein, consistent with the effect of intranasal delivery of ESAT-6. Silencing SAA3 reduced Mtb-induced IL-1{beta} production by BMDMs. We conclude that the production of SAA3 is required for Mtb stimulated IL-1{beta} production by macrophages in tuberculosis infection.",2020-04-05,immunology,Tuberculosis,Tuberculosis
10.1101/2020.03.09.983494,"Reprogramming the endogenous type III-A CRISPR-Cas system for genome editing, RNA interference and CRISPRi screening in Mycobacterium tuberculosis","Mycobacterium tuberculosis (M.tb) causes the current leading infectious disease. Examination of the functional genomics of M.tb and development of drugs and vaccines are hampered by the complicated and time-consuming genetic manipulation techniques for M.tb. Here, we reprogrammed M.tb endogenous type III-A CRISPR-Cas10 system for simple and efficient gene editing, RNA interference and screening via simple delivery of a plasmid harboring a mini-CRISPR array, thereby avoiding the introduction of exogenous proteins and minimizing proteotoxicity. We demonstrated that M.tb genes were efficiently and specifically knocked-in/out by this system, which was confirmed by whole-genome sequencing. This system was further employed for single and simultaneous multiple-gene RNA interference. Moreover, we successfully applied this system for genome-wide CRISPR interference screening to identify the in-vitro and intracellular growth-regulating genes. This system can be extensively used to explore the functional genomics of M.tb and facilitate the development of new anti-Mycobacterial drugs and vaccines.

SummaryTuberculosis caused by Mycobacterium tuberculosis (M.tb) is the current leading infectious disease affecting more than ten million people annually. To dissect the functional genomics and understand its virulence, persistence, and antibiotics resistance, a powerful genome editing tool and high-throughput screening methods are desperately wanted. Our study developed an efficient and a robust tool for genome editing and RNA interference in M.tb using its endogenous CRISPR cas10 system. Moreover, the system has been successfully applied for genome-wide CRISPR interference screening. This tool could be employed to explore the functional genomics of M.tb and facilitate the development of anti-M.tb drugs and vaccines.",2020-03-09,microbiology,Tuberculosis,Tuberculosis
